{
    "$schema": "https://json-schema.org/draft-04/schema#",
    "type": "object",
    "properties": {
        "@targetNamespace": {"type": "string"},
        "@elementFormDefault": {"type": "string"},
        "@version": {"type": "string"},
        "include": {"$ref": "#/definitions/include_type"},
        "element": {"$ref": "#/definitions/element_type"},
        "complexType": {"$ref": "#/definitions/complexType_type"}
    },
    "definitions": {
        "include_type": {
            "type": "object",
            "properties": {
                "@schemaLocation": {"type": "string"}
            }
        },
        "annotation_type": {
            "type": "object",
            "properties": {
                "documentation": {"type": "string"}
            }
        },
        "element_type": {
            "type": "object",
            "properties": {
                "@name": {"type": "string"},
                "@type": {"type": "string"},
                "annotation": {"$ref": "#/definitions/annotation_type"}
            }
        },
        "element2_type": {
            "type": "array",
            "minItems": 0,
            "items": {
                "type": "object",
                "properties": {
                    "@name": {"type": "string"},
                    "@type": {"type": "string"},
                    "@minOccurs": {"type": "string"},
                    "@maxOccurs": {"type": "string"}
                },
                "required": [
                    "@name",
                    "@type"
                ]
            }
        },
        "sequence_type": {
            "type": "object",
            "properties": {
                "element": {"$ref": "#/definitions/element2_type"}
            }
        },
        "enumeration_type": {
            "type": "object",
            "properties": {
                "@value": {"type": "string"}
            }
        },
        "restriction_type": {
            "type": "object",
            "properties": {
                "@base": {"type": "string"},
                "enumeration": {"$ref": "#/definitions/enumeration_type"}
            }
        },
        "simpleType_type": {
            "type": "object",
            "properties": {
                "restriction": {"$ref": "#/definitions/restriction_type"}
            }
        },
        "attribute_type": {
            "type": "array",
            "minItems": 0,
            "items": {
                "type": "object",
                "properties": {
                    "@name": {"type": "string"},
                    "@type": {"type": "string"},
                    "@use": {"type": "string"},
                    "annotation": {"$ref": "#/definitions/annotation_type"},
                    "@default": {"type": "string"},
                    "simpleType": {"$ref": "#/definitions/simpleType_type"}
                },
                "required": [
                    "annotation",
                    "@name",
                    "@use"
                ]
            }
        },
        "attribute2_type": {
            "type": "object",
            "properties": {
                "@name": {"type": "string"},
                "@type": {"type": "string"},
                "@use": {"type": "string"},
                "annotation": {"$ref": "#/definitions/annotation_type"}
            }
        },
        "extension_type": {
            "type": "object",
            "properties": {
                "@base": {"type": "string"},
                "attribute": {"$ref": "#/definitions/attribute2_type"}
            }
        },
        "complexContent_type": {
            "type": "object",
            "properties": {
                "extension": {"$ref": "#/definitions/extension_type"}
            }
        },
        "complexType_type": {
            "type": "array",
            "minItems": 0,
            "items": {
                "type": "object",
                "properties": {
                    "@name": {"type": "string"},
                    "annotation": {"$ref": "#/definitions/annotation_type"},
                    "sequence": {"$ref": "#/definitions/sequence_type"},
                    "attribute": {"$ref": "#/definitions/attribute_type"},
                    "complexContent": {"$ref": "#/definitions/complexContent_type"}
                },
                "required": ["@name"]
            }
        }
    }
}