{
   "@targetNamespace": "http://data.europa.eu/europass/model/credentials#",
   "@elementFormDefault": "qualified",
   "@version": "0.4.0",
   "include": {
      "@schemaLocation": "edci_credentialTypes.xsd"
   },
   "element": {
      "@name": "europassCredential",
      "@type": "EuropassCredentialType",
      "annotation": {
         "documentation": "A set of claims made by an issuer in Europe, using the Europass Standards.  A Europass credential is a set of one or more claims which may be used to demonstrate that the owner has certain skills or has achieved certain learning outcomes through formal, non-formal or informal learning."
      },
      "unique": [
         {
            "@name": "title",
            "selector": {
               "@xpath": "eup:title"
            },
            "field": {
               "@xpath": "@lang"
            }
         },
         {
            "@name": "description",
            "selector": {
               "@xpath": "eup:description/eup:text"
            },
            "field": {
               "@xpath": "@lang"
            }
         }
      ],
      "key": [
         {
            "@name": "learningSpecificationKey",
            "selector": {
               "@xpath": "eup:learningSpecificationReferences/eup:*"
            },
            "field": {
               "@xpath": "@id"
            }
         },
         {
            "@name": "learningActivitySpecificationKey",
            "selector": {
               "@xpath": "eup:learningActivitySpecificationReferences/eup:*"
            },
            "field": {
               "@xpath": "@id"
            }
         },
         {
            "@name": "assessmentSpecificationKey",
            "selector": {
               "@xpath": "eup:assessmentSpecificationReferences/eup:*"
            },
            "field": {
               "@xpath": "@id"
            }
         },
         {
            "@name": "entitlementSpecificationKey",
            "selector": {
               "@xpath": "eup:entitlementSpecificationReferences/eup:*"
            },
            "field": {
               "@xpath": "@id"
            }
         },
         {
            "@name": "learningOpportunityKey",
            "selector": {
               "@xpath": "eup:learningOpportunityReferences/eup:*"
            },
            "field": {
               "@xpath": "@id"
            }
         },
         {
            "@name": "accreditationKey",
            "selector": {
               "@xpath": "eup:accreditationReferences/eup:*"
            },
            "field": {
               "@xpath": "@id"
            }
         },
         {
            "@name": "frameworkKey",
            "selector": {
               "@xpath": "eup:semanticFrameworkReferences/eup:*"
            },
            "field": {
               "@xpath": "@id"
            }
         },
         {
            "@name": "agentKey",
            "selector": {
               "@xpath": "eup:agentReferences/eup:organization"
            },
            "field": {
               "@xpath": "@id"
            }
         },
         {
            "@name": "scoringSchemeKey",
            "selector": {
               "@xpath": "eup:scoringSchemeReferences/eup:scoringScheme"
            },
            "field": {
               "@xpath": "@id"
            }
         },
         {
            "@name": "achievementKey",
            "selector": {
               "@xpath": "eup:credentialSubject/eup:achievements/eup:*"
            },
            "field": {
               "@xpath": "@id"
            }
         },
         {
            "@name": "activityKey",
            "selector": {
               "@xpath": "eup:credentialSubject/eup:activities/eup:*"
            },
            "field": {
               "@xpath": "@id"
            }
         },
         {
            "@name": "assessmentKey",
            "selector": {
               "@xpath": "eup:credentialSubject/eup:assessments/eup:*"
            },
            "field": {
               "@xpath": "@id"
            }
         },
         {
            "@name": "entitlementKey",
            "selector": {
               "@xpath": "eup:credentialSubject/eup:entitlements/eup:*"
            },
            "field": {
               "@xpath": "@id"
            }
         },
         {
            "@name": "awardingKey",
            "selector": {
               "@xpath": "eup:credentialSubject/eup:awardings/eup:*"
            },
            "field": {
               "@xpath": "@id"
            }
         }
      ],
      "keyref": [
         {
            "@name": "learningSpecKeyRef1",
            "@refer": "learningSpecificationKey",
            "selector": {
               "@xpath": "eup:learningSpecificationReferences/eup:*/eup:hasPart"
            },
            "field": {
               "@xpath": "@idref"
            }
         },
         {
            "@name": "learningSpecKeyRef2",
            "@refer": "learningSpecificationKey",
            "selector": {
               "@xpath": "eup:learningSpecificationReferences/eup:*/eup:specializationOf"
            },
            "field": {
               "@xpath": "@idref"
            }
         },
         {
            "@name": "learningSpecKeyRef3",
            "@refer": "learningSpecificationKey",
            "selector": {
               "@xpath": "eup:credentialSubject/eup:achievements/eup:learningAchievement/eup:specifiedBy"
            },
            "field": {
               "@xpath": "@idref"
            }
         },
         {
            "@name": "learningSpecKeyRef4",
            "@refer": "learningSpecificationKey",
            "selector": {
               "@xpath": "eup:credentialSubject/eup:achievements/eup:qualificationAward/eup:specifiedBy"
            },
            "field": {
               "@xpath": "@idref"
            }
         },
         {
            "@name": "learningSpecKeyRef5",
            "@refer": "learningSpecificationKey",
            "selector": {
               "@xpath": "eup:learningOpportunityReferences/eup:*/eup:specifiedBy"
            },
            "field": {
               "@xpath": "@idref"
            }
         },
         {
            "@name": "learningSpecKeyRef6",
            "@refer": "learningSpecificationKey",
            "selector": {
               "@xpath": "eup:assessmentSpecificationReferences/eup:*/eup:proves"
            },
            "field": {
               "@xpath": "@idref"
            }
         },
         {
            "@name": "learningSpecKeyRef7",
            "@refer": "learningSpecificationKey",
            "selector": {
               "@xpath": "eup:learningActivitySpecificationReferences/eup:*/eup:teaches"
            },
            "field": {
               "@xpath": "@idref"
            }
         },
         {
            "@name": "learningSpecKeyRef8",
            "@refer": "learningSpecificationKey",
            "selector": {
               "@xpath": "eup:accreditationReferences/eup:*/eup:limitQualification"
            },
            "field": {
               "@xpath": "@idref"
            }
         },
         {
            "@name": "learningSpecKeyRef9",
            "@refer": "learningSpecificationKey",
            "selector": {
               "@xpath": "eup:entitlementSpecificationReferences/eup:*/eup:mayResultFrom"
            },
            "field": {
               "@xpath": "@idref"
            }
         },
         {
            "@name": "learningActSpecKeyRef1",
            "@refer": "learningActivitySpecificationKey",
            "selector": {
               "@xpath": "eup:learningActivitySpecificationReferences/eup:*/eup:hasPart"
            },
            "field": {
               "@xpath": "@idref"
            }
         },
         {
            "@name": "learningActSpecKeyRef2",
            "@refer": "learningActivitySpecificationKey",
            "selector": {
               "@xpath": "eup:learningActivitySpecificationReferences/eup:*/eup:specializationOf"
            },
            "field": {
               "@xpath": "@idref"
            }
         },
         {
            "@name": "learningActSpecKeyRef3",
            "@refer": "learningActivitySpecificationKey",
            "selector": {
               "@xpath": "eup:learningSpecificationReferences/eup:*/eup:learningActivitySpecification"
            },
            "field": {
               "@xpath": "@idref"
            }
         },
         {
            "@name": "learningActSpecKeyRef4",
            "@refer": "learningActivitySpecificationKey",
            "selector": {
               "@xpath": "eup:credentialSubject/eup:activities/eup:activity/eup:specifiedBy"
            },
            "field": {
               "@xpath": "@idref"
            }
         },
         {
            "@name": "assessmentSpecKeyRef1",
            "@refer": "assessmentSpecificationKey",
            "selector": {
               "@xpath": "eup:assessmentSpecificationReferences/eup:*/eup:hasPart"
            },
            "field": {
               "@xpath": "@idref"
            }
         },
         {
            "@name": "assessmentSpecKeyRef2",
            "@refer": "assessmentSpecificationKey",
            "selector": {
               "@xpath": "eup:assessmentSpecificationReferences/eup:*/eup:specializationOf"
            },
            "field": {
               "@xpath": "@idref"
            }
         },
         {
            "@name": "assessmentSpecKeyRef3",
            "@refer": "assessmentSpecificationKey",
            "selector": {
               "@xpath": "eup:learningSpecificationReferences/eup:*/eup:assessmentSpecification"
            },
            "field": {
               "@xpath": "@idref"
            }
         },
         {
            "@name": "assessmentSpecKeyRef4",
            "@refer": "assessmentSpecificationKey",
            "selector": {
               "@xpath": "eup:credentialSubject/eup:assessments/eup:assessment/eup:specifiedBy"
            },